No.     Time               Source                Destination           Protocol Length Info
      4 12:38:30,852357879 172.24.1.11           172.24.1.12           HTTP     112    GET /dashboard/ HTTP/1.1 

Frame 4: 112 bytes on wire (896 bits), 112 bytes captured (896 bits) on interface wlp3s0, id 0
Ethernet II, Src: Intel_d5:7a:9b (6c:29:95:d5:7a:9b), Dst: Intel_d0:e8:cd (a4:34:d9:d0:e8:cd)
Internet Protocol Version 4, Src: 172.24.1.11, Dst: 172.24.1.12
Transmission Control Protocol, Src Port: 43676, Dst Port: 80, Seq: 1, Ack: 1, Len: 46
Hypertext Transfer Protocol
    GET /dashboard/ HTTP/1.1\r\n
    Host:172.24.1.12\r\n
    \r\n
    [Full request URI: http://172.24.1.12/dashboard/]
    [HTTP request 1/1]
    [Response in frame: 9]

No.     Time               Source                Destination           Protocol Length Info
      9 12:38:30,870346959 172.24.1.12           172.24.1.11           HTTP     4060   HTTP/1.1 200 OK  (text/html)

Frame 9: 4060 bytes on wire (32480 bits), 4060 bytes captured (32480 bits) on interface wlp3s0, id 0
Ethernet II, Src: Intel_d0:e8:cd (a4:34:d9:d0:e8:cd), Dst: Intel_d5:7a:9b (6c:29:95:d5:7a:9b)
Internet Protocol Version 4, Src: 172.24.1.12, Dst: 172.24.1.11
Transmission Control Protocol, Src Port: 80, Dst Port: 43676, Seq: 1449, Ack: 47, Len: 3994
[2 Reassembled TCP Segments (5442 bytes): #5(1448), #9(3994)]
Hypertext Transfer Protocol
    HTTP/1.1 200 OK\r\n
    Date: Mon, 08 Apr 2024 11:38:30 GMT\r\n
    Server: Apache/2.4.58 (Win64) OpenSSL/3.1.3 PHP/8.2.12\r\n
    Last-Modified: Sun, 19 Nov 2023 11:18:30 GMT\r\n
    ETag: "1443-60a7f87754d80"\r\n
    Accept-Ranges: bytes\r\n
    Content-Length: 5187\r\n
    Content-Type: text/html\r\n
    \r\n
    [HTTP response 1/1]
    [Time since request: 0.017989080 seconds]
    [Request in frame: 4]
    [Request URI: http://172.24.1.12/dashboard/]
    File Data: 5187 bytes
Line-based text data: text/html (130 lines)

No.     Time               Source                Destination           Protocol Length Info
     13 12:38:30,877863055 172.24.1.11           172.24.1.12           HTTP     111    GET /dashboard HTTP/1.1 

Frame 13: 111 bytes on wire (888 bits), 111 bytes captured (888 bits) on interface wlp3s0, id 0
Ethernet II, Src: Intel_d5:7a:9b (6c:29:95:d5:7a:9b), Dst: Intel_d0:e8:cd (a4:34:d9:d0:e8:cd)
Internet Protocol Version 4, Src: 172.24.1.11, Dst: 172.24.1.12
Transmission Control Protocol, Src Port: 43684, Dst Port: 80, Seq: 1, Ack: 1, Len: 45
Hypertext Transfer Protocol
    GET /dashboard HTTP/1.1\r\n
    Host:172.24.1.12\r\n
    \r\n
    [Full request URI: http://172.24.1.12/dashboard]
    [HTTP request 1/1]
    [Response in frame: 14]

No.     Time               Source                Destination           Protocol Length Info
     14 12:38:30,886871187 172.24.1.12           172.24.1.11           HTTP     638    HTTP/1.1 301 Moved Permanently  (text/html)

Frame 14: 638 bytes on wire (5104 bits), 638 bytes captured (5104 bits) on interface wlp3s0, id 0
Ethernet II, Src: Intel_d0:e8:cd (a4:34:d9:d0:e8:cd), Dst: Intel_d5:7a:9b (6c:29:95:d5:7a:9b)
Internet Protocol Version 4, Src: 172.24.1.12, Dst: 172.24.1.11
Transmission Control Protocol, Src Port: 80, Dst Port: 43684, Seq: 1, Ack: 46, Len: 572
Hypertext Transfer Protocol
    HTTP/1.1 301 Moved Permanently\r\n
    Date: Mon, 08 Apr 2024 11:38:30 GMT\r\n
    Server: Apache/2.4.58 (Win64) OpenSSL/3.1.3 PHP/8.2.12\r\n
    Location: http://172.24.1.12/dashboard/\r\n
    Content-Length: 338\r\n
    Content-Type: text/html; charset=iso-8859-1\r\n
    \r\n
    [HTTP response 1/1]
    [Time since request: 0.009008132 seconds]
    [Request in frame: 13]
    [Request URI: http://172.24.1.12/dashboard]
    File Data: 338 bytes
Line-based text data: text/html (9 lines)

No.     Time               Source                Destination           Protocol Length Info
     22 12:38:30,894449458 172.24.1.11           172.24.1.12           HTTP     102    PUT / HTTP/1.1 

Frame 22: 102 bytes on wire (816 bits), 102 bytes captured (816 bits) on interface wlp3s0, id 0
Ethernet II, Src: Intel_d5:7a:9b (6c:29:95:d5:7a:9b), Dst: Intel_d0:e8:cd (a4:34:d9:d0:e8:cd)
Internet Protocol Version 4, Src: 172.24.1.11, Dst: 172.24.1.12
Transmission Control Protocol, Src Port: 43692, Dst Port: 80, Seq: 1, Ack: 1, Len: 36
Hypertext Transfer Protocol
    PUT / HTTP/1.1\r\n
    Host:172.24.1.12\r\n
    \r\n
    [Full request URI: http://172.24.1.12/]
    [HTTP request 1/1]
    [Response in frame: 23]

No.     Time               Source                Destination           Protocol Length Info
     23 12:38:30,903540727 172.24.1.12           172.24.1.11           HTTP     307    HTTP/1.1 302 Found 

Frame 23: 307 bytes on wire (2456 bits), 307 bytes captured (2456 bits) on interface wlp3s0, id 0
Ethernet II, Src: Intel_d0:e8:cd (a4:34:d9:d0:e8:cd), Dst: Intel_d5:7a:9b (6c:29:95:d5:7a:9b)
Internet Protocol Version 4, Src: 172.24.1.12, Dst: 172.24.1.11
Transmission Control Protocol, Src Port: 80, Dst Port: 43692, Seq: 1, Ack: 37, Len: 241
Hypertext Transfer Protocol
    HTTP/1.1 302 Found\r\n
    Date: Mon, 08 Apr 2024 11:38:30 GMT\r\n
    Server: Apache/2.4.58 (Win64) OpenSSL/3.1.3 PHP/8.2.12\r\n
    X-Powered-By: PHP/8.2.12\r\n
    Location: http://172.24.1.12/dashboard/\r\n
    Content-Length: 0\r\n
    Content-Type: text/html; charset=UTF-8\r\n
    \r\n
    [HTTP response 1/1]
    [Time since request: 0.009091269 seconds]
    [Request in frame: 22]
    [Request URI: http://172.24.1.12/]

No.     Time               Source                Destination           Protocol Length Info
     31 12:38:30,911054050 172.24.1.11           172.24.1.12           HTTP     110    GET /dashboard HTTP/1. 

Frame 31: 110 bytes on wire (880 bits), 110 bytes captured (880 bits) on interface wlp3s0, id 0
Ethernet II, Src: Intel_d5:7a:9b (6c:29:95:d5:7a:9b), Dst: Intel_d0:e8:cd (a4:34:d9:d0:e8:cd)
Internet Protocol Version 4, Src: 172.24.1.11, Dst: 172.24.1.12
Transmission Control Protocol, Src Port: 43702, Dst Port: 80, Seq: 1, Ack: 1, Len: 44
Hypertext Transfer Protocol
    GET /dashboard HTTP/1.\r\n
    Host:172.24.1.12\r\n
    \r\n
    [Full request URI: http://172.24.1.12/dashboard]
    [HTTP request 1/1]
    [Response in frame: 32]

No.     Time               Source                Destination           Protocol Length Info
     32 12:38:30,919000597 172.24.1.12           172.24.1.11           HTTP     597    HTTP/1.1 400 Bad Request  (text/html)

Frame 32: 597 bytes on wire (4776 bits), 597 bytes captured (4776 bits) on interface wlp3s0, id 0
Ethernet II, Src: Intel_d0:e8:cd (a4:34:d9:d0:e8:cd), Dst: Intel_d5:7a:9b (6c:29:95:d5:7a:9b)
Internet Protocol Version 4, Src: 172.24.1.12, Dst: 172.24.1.11
Transmission Control Protocol, Src Port: 80, Dst Port: 43702, Seq: 1, Ack: 45, Len: 531
Hypertext Transfer Protocol
    HTTP/1.1 400 Bad Request\r\n
    Date: Mon, 08 Apr 2024 11:38:30 GMT\r\n
    Server: Apache/2.4.58 (Win64) OpenSSL/3.1.3 PHP/8.2.12\r\n
    Content-Length: 325\r\n
    Connection: close\r\n
    Content-Type: text/html; charset=iso-8859-1\r\n
    \r\n
    [HTTP response 1/1]
    [Time since request: 0.007946547 seconds]
    [Request in frame: 31]
    [Request URI: http://172.24.1.12/dashboard]
    File Data: 325 bytes
Line-based text data: text/html (10 lines)

No.     Time               Source                Destination           Protocol Length Info
     40 12:38:30,928910056 172.24.1.11           172.24.1.12           HTTP     121    GET /dashboard/index.htm HTTP/1.1 

Frame 40: 121 bytes on wire (968 bits), 121 bytes captured (968 bits) on interface wlp3s0, id 0
Ethernet II, Src: Intel_d5:7a:9b (6c:29:95:d5:7a:9b), Dst: Intel_d0:e8:cd (a4:34:d9:d0:e8:cd)
Internet Protocol Version 4, Src: 172.24.1.11, Dst: 172.24.1.12
Transmission Control Protocol, Src Port: 43714, Dst Port: 80, Seq: 1, Ack: 1, Len: 55
Hypertext Transfer Protocol
    GET /dashboard/index.htm HTTP/1.1\r\n
    Host:172.24.1.12\r\n
    \r\n
    [Full request URI: http://172.24.1.12/dashboard/index.htm]
    [HTTP request 1/1]
    [Response in frame: 41]

No.     Time               Source                Destination           Protocol Length Info
     41 12:38:30,937563782 172.24.1.12           172.24.1.11           HTTP     548    HTTP/1.1 404 Not Found  (text/html)

Frame 41: 548 bytes on wire (4384 bits), 548 bytes captured (4384 bits) on interface wlp3s0, id 0
Ethernet II, Src: Intel_d0:e8:cd (a4:34:d9:d0:e8:cd), Dst: Intel_d5:7a:9b (6c:29:95:d5:7a:9b)
Internet Protocol Version 4, Src: 172.24.1.12, Dst: 172.24.1.11
Transmission Control Protocol, Src Port: 80, Dst Port: 43714, Seq: 1, Ack: 56, Len: 482
Hypertext Transfer Protocol
    HTTP/1.1 404 Not Found\r\n
    Date: Mon, 08 Apr 2024 11:38:30 GMT\r\n
    Server: Apache/2.4.58 (Win64) OpenSSL/3.1.3 PHP/8.2.12\r\n
    Content-Length: 297\r\n
    Content-Type: text/html; charset=iso-8859-1\r\n
    \r\n
    [HTTP response 1/1]
    [Time since request: 0.008653726 seconds]
    [Request in frame: 40]
    [Request URI: http://172.24.1.12/dashboard/index.htm]
    File Data: 297 bytes
Line-based text data: text/html (9 lines)

No.     Time               Source                Destination           Protocol Length Info
     49 12:38:30,945225933 172.24.1.11           172.24.1.12           HTTP     103    PUT /d HTTP/1.1 

Frame 49: 103 bytes on wire (824 bits), 103 bytes captured (824 bits) on interface wlp3s0, id 0
Ethernet II, Src: Intel_d5:7a:9b (6c:29:95:d5:7a:9b), Dst: Intel_d0:e8:cd (a4:34:d9:d0:e8:cd)
Internet Protocol Version 4, Src: 172.24.1.11, Dst: 172.24.1.12
Transmission Control Protocol, Src Port: 43726, Dst Port: 80, Seq: 1, Ack: 1, Len: 37
Hypertext Transfer Protocol
    PUT /d HTTP/1.1\r\n
    Host:172.24.1.12\r\n
    \r\n
    [Full request URI: http://172.24.1.12/d]
    [HTTP request 1/1]
    [Response in frame: 50]

No.     Time               Source                Destination           Protocol Length Info
     50 12:38:30,953700077 172.24.1.12           172.24.1.11           HTTP     617    HTTP/1.1 405 Method Not Allowed  (text/html)

Frame 50: 617 bytes on wire (4936 bits), 617 bytes captured (4936 bits) on interface wlp3s0, id 0
Ethernet II, Src: Intel_d0:e8:cd (a4:34:d9:d0:e8:cd), Dst: Intel_d5:7a:9b (6c:29:95:d5:7a:9b)
Internet Protocol Version 4, Src: 172.24.1.12, Dst: 172.24.1.11
Transmission Control Protocol, Src Port: 80, Dst Port: 43726, Seq: 1, Ack: 38, Len: 551
Hypertext Transfer Protocol
    HTTP/1.1 405 Method Not Allowed\r\n
    Date: Mon, 08 Apr 2024 11:38:30 GMT\r\n
    Server: Apache/2.4.58 (Win64) OpenSSL/3.1.3 PHP/8.2.12\r\n
    Allow: GET,POST,OPTIONS,HEAD,TRACE\r\n
    Content-Length: 321\r\n
    Content-Type: text/html; charset=iso-8859-1\r\n
    \r\n
    [HTTP response 1/1]
    [Time since request: 0.008474144 seconds]
    [Request in frame: 49]
    [Request URI: http://172.24.1.12/d]
    File Data: 321 bytes
Line-based text data: text/html (9 lines)

No.     Time               Source                Destination           Protocol Length Info
     60 12:38:30,991817747 172.24.1.12           172.24.1.11           HTTP     616    HTTP/1.1 501 Not Implemented  (text/html)

Frame 60: 616 bytes on wire (4928 bits), 616 bytes captured (4928 bits) on interface wlp3s0, id 0
Ethernet II, Src: Intel_d0:e8:cd (a4:34:d9:d0:e8:cd), Dst: Intel_d5:7a:9b (6c:29:95:d5:7a:9b)
Internet Protocol Version 4, Src: 172.24.1.12, Dst: 172.24.1.11
Transmission Control Protocol, Src Port: 80, Dst Port: 43742, Seq: 1, Ack: 45, Len: 550
Hypertext Transfer Protocol
    HTTP/1.1 501 Not Implemented\r\n
    Date: Mon, 08 Apr 2024 11:38:30 GMT\r\n
    Server: Apache/2.4.58 (Win64) OpenSSL/3.1.3 PHP/8.2.12\r\n
    Allow: GET,POST,OPTIONS,HEAD,TRACE\r\n
    Content-Length: 304\r\n
    Connection: close\r\n
    Content-Type: text/html; charset=iso-8859-1\r\n
    \r\n
    [HTTP response 1/1]
    File Data: 304 bytes
Line-based text data: text/html (10 lines)
