No.     Time               Source                Destination           Protocol Length Info
      4 22:00:34,820639952 172.24.1.11           172.24.1.12           HTTP     419    GET / HTTP/1.1 

Frame 4: 419 bytes on wire (3352 bits), 419 bytes captured (3352 bits) on interface wlp3s0, id 0
    Section number: 1
    Interface id: 0 (wlp3s0)
        Interface name: wlp3s0
    Encapsulation type: Ethernet (1)
    Arrival Time: Mar 12, 2024 22:00:34.820639952 WET
    UTC Arrival Time: Mar 12, 2024 22:00:34.820639952 UTC
    Epoch Arrival Time: 1710280834.820639952
    [Time shift for this packet: 0.000000000 seconds]
    [Time delta from previous captured frame: 0.000129542 seconds]
    [Time delta from previous displayed frame: 0.000000000 seconds]
    [Time since reference or first frame: 0.007913187 seconds]
    Frame Number: 4
    Frame Length: 419 bytes (3352 bits)
    Capture Length: 419 bytes (3352 bits)
    [Frame is marked: False]
    [Frame is ignored: False]
    [Protocols in frame: eth:ethertype:ip:tcp:http]
    [Coloring Rule Name: HTTP]
    [Coloring Rule String: http || tcp.port == 80 || http2]
Ethernet II, Src: Intel_d5:7a:9b (6c:29:95:d5:7a:9b), Dst: Intel_d0:e8:cd (a4:34:d9:d0:e8:cd)
    Destination: Intel_d0:e8:cd (a4:34:d9:d0:e8:cd)
        Address: Intel_d0:e8:cd (a4:34:d9:d0:e8:cd)
        .... ..0. .... .... .... .... = LG bit: Globally unique address (factory default)
        .... ...0 .... .... .... .... = IG bit: Individual address (unicast)
    Source: Intel_d5:7a:9b (6c:29:95:d5:7a:9b)
        Address: Intel_d5:7a:9b (6c:29:95:d5:7a:9b)
        .... ..0. .... .... .... .... = LG bit: Globally unique address (factory default)
        .... ...0 .... .... .... .... = IG bit: Individual address (unicast)
    Type: IPv4 (0x0800)
Internet Protocol Version 4, Src: 172.24.1.11, Dst: 172.24.1.12
    0100 .... = Version: 4
    .... 0101 = Header Length: 20 bytes (5)
    Differentiated Services Field: 0x00 (DSCP: CS0, ECN: Not-ECT)
        0000 00.. = Differentiated Services Codepoint: Default (0)
        .... ..00 = Explicit Congestion Notification: Not ECN-Capable Transport (0)
    Total Length: 405
    Identification: 0x9c91 (40081)
    010. .... = Flags: 0x2, Don't fragment
        0... .... = Reserved bit: Not set
        .1.. .... = Don't fragment: Set
        ..0. .... = More fragments: Not set
    ...0 0000 0000 0000 = Fragment Offset: 0
    Time to Live: 64
    Protocol: TCP (6)
    Header Checksum: 0x428a [validation disabled]
    [Header checksum status: Unverified]
    Source Address: 172.24.1.11
    Destination Address: 172.24.1.12
Transmission Control Protocol, Src Port: 39124, Dst Port: 80, Seq: 1, Ack: 1, Len: 353
    Source Port: 39124
    Destination Port: 80
    [Stream index: 0]
    [Conversation completeness: Incomplete, DATA (15)]
        ..0. .... = RST: Absent
        ...0 .... = FIN: Absent
        .... 1... = Data: Present
        .... .1.. = ACK: Present
        .... ..1. = SYN-ACK: Present
        .... ...1 = SYN: Present
        [Completeness Flags: ··DASS]
    [TCP Segment Len: 353]
    Sequence Number: 1    (relative sequence number)
    Sequence Number (raw): 813982225
    [Next Sequence Number: 354    (relative sequence number)]
    Acknowledgment Number: 1    (relative ack number)
    Acknowledgment number (raw): 914782657
    1000 .... = Header Length: 32 bytes (8)
    Flags: 0x018 (PSH, ACK)
        000. .... .... = Reserved: Not set
        ...0 .... .... = Accurate ECN: Not set
        .... 0... .... = Congestion Window Reduced: Not set
        .... .0.. .... = ECN-Echo: Not set
        .... ..0. .... = Urgent: Not set
        .... ...1 .... = Acknowledgment: Set
        .... .... 1... = Push: Set
        .... .... .0.. = Reset: Not set
        .... .... ..0. = Syn: Not set
        .... .... ...0 = Fin: Not set
        [TCP Flags: ·······AP···]
    Window: 251
    [Calculated window size: 32128]
    [Window size scaling factor: 128]
    Checksum: 0x5124 [unverified]
    [Checksum Status: Unverified]
    Urgent Pointer: 0
    Options: (12 bytes), No-Operation (NOP), No-Operation (NOP), Timestamps
        TCP Option - No-Operation (NOP)
            Kind: No-Operation (1)
        TCP Option - No-Operation (NOP)
            Kind: No-Operation (1)
        TCP Option - Timestamps: TSval 2272454540, TSecr 281264007
            Kind: Time Stamp Option (8)
            Length: 10
            Timestamp value: 2272454540
            Timestamp echo reply: 281264007
    [Timestamps]
        [Time since first frame in this TCP stream: 0.007913187 seconds]
        [Time since previous frame in this TCP stream: 0.000129542 seconds]
    [SEQ/ACK analysis]
        [iRTT: 0.007783645 seconds]
        [Bytes in flight: 353]
        [Bytes sent since last PSH flag: 353]
    TCP payload (353 bytes)
Hypertext Transfer Protocol
    GET / HTTP/1.1\r\n
        [Expert Info (Chat/Sequence): GET / HTTP/1.1\r\n]
            [GET / HTTP/1.1\r\n]
            [Severity level: Chat]
            [Group: Sequence]
        Request Method: GET
        Request URI: /
        Request Version: HTTP/1.1
    Host: 172.24.1.12\r\n
    User-Agent: Mozilla/5.0 (Windows NT 10.0; rv:123.0) Gecko/20100101 Firefox/123.0\r\n
    Accept: text/html,application/xhtml+xml,application/xml;q=0.9,image/avif,image/webp,*/*;q=0.8\r\n
    Accept-Language: en-US,en;q=0.5\r\n
    Accept-Encoding: gzip, deflate\r\n
    DNT: 1\r\n
    Sec-GPC: 1\r\n
    Connection: keep-alive\r\n
    Upgrade-Insecure-Requests: 1\r\n
    \r\n
    [Full request URI: http://172.24.1.12/]
    [HTTP request 1/5]
    [Response in frame: 5]
    [Next request in frame: 7]

No.     Time               Source                Destination           Protocol Length Info
      5 22:00:34,833097828 172.24.1.12           172.24.1.11           HTTP     363    HTTP/1.1 302 Found 

Frame 5: 363 bytes on wire (2904 bits), 363 bytes captured (2904 bits) on interface wlp3s0, id 0
    Section number: 1
    Interface id: 0 (wlp3s0)
        Interface name: wlp3s0
    Encapsulation type: Ethernet (1)
    Arrival Time: Mar 12, 2024 22:00:34.833097828 WET
    UTC Arrival Time: Mar 12, 2024 22:00:34.833097828 UTC
    Epoch Arrival Time: 1710280834.833097828
    [Time shift for this packet: 0.000000000 seconds]
    [Time delta from previous captured frame: 0.012457876 seconds]
    [Time delta from previous displayed frame: 0.012457876 seconds]
    [Time since reference or first frame: 0.020371063 seconds]
    Frame Number: 5
    Frame Length: 363 bytes (2904 bits)
    Capture Length: 363 bytes (2904 bits)
    [Frame is marked: False]
    [Frame is ignored: False]
    [Protocols in frame: eth:ethertype:ip:tcp:http]
    [Coloring Rule Name: HTTP]
    [Coloring Rule String: http || tcp.port == 80 || http2]
Ethernet II, Src: Intel_d0:e8:cd (a4:34:d9:d0:e8:cd), Dst: Intel_d5:7a:9b (6c:29:95:d5:7a:9b)
    Destination: Intel_d5:7a:9b (6c:29:95:d5:7a:9b)
        Address: Intel_d5:7a:9b (6c:29:95:d5:7a:9b)
        .... ..0. .... .... .... .... = LG bit: Globally unique address (factory default)
        .... ...0 .... .... .... .... = IG bit: Individual address (unicast)
    Source: Intel_d0:e8:cd (a4:34:d9:d0:e8:cd)
        Address: Intel_d0:e8:cd (a4:34:d9:d0:e8:cd)
        .... ..0. .... .... .... .... = LG bit: Globally unique address (factory default)
        .... ...0 .... .... .... .... = IG bit: Individual address (unicast)
    Type: IPv4 (0x0800)
Internet Protocol Version 4, Src: 172.24.1.12, Dst: 172.24.1.11
    0100 .... = Version: 4
    .... 0101 = Header Length: 20 bytes (5)
    Differentiated Services Field: 0x00 (DSCP: CS0, ECN: Not-ECT)
        0000 00.. = Differentiated Services Codepoint: Default (0)
        .... ..00 = Explicit Congestion Notification: Not ECN-Capable Transport (0)
    Total Length: 349
    Identification: 0x16b6 (5814)
    010. .... = Flags: 0x2, Don't fragment
        0... .... = Reserved bit: Not set
        .1.. .... = Don't fragment: Set
        ..0. .... = More fragments: Not set
    ...0 0000 0000 0000 = Fragment Offset: 0
    Time to Live: 128
    Protocol: TCP (6)
    Header Checksum: 0x889d [validation disabled]
    [Header checksum status: Unverified]
    Source Address: 172.24.1.12
    Destination Address: 172.24.1.11
Transmission Control Protocol, Src Port: 80, Dst Port: 39124, Seq: 1, Ack: 354, Len: 297
    Source Port: 80
    Destination Port: 39124
    [Stream index: 0]
    [Conversation completeness: Incomplete, DATA (15)]
        ..0. .... = RST: Absent
        ...0 .... = FIN: Absent
        .... 1... = Data: Present
        .... .1.. = ACK: Present
        .... ..1. = SYN-ACK: Present
        .... ...1 = SYN: Present
        [Completeness Flags: ··DASS]
    [TCP Segment Len: 297]
    Sequence Number: 1    (relative sequence number)
    Sequence Number (raw): 914782657
    [Next Sequence Number: 298    (relative sequence number)]
    Acknowledgment Number: 354    (relative ack number)
    Acknowledgment number (raw): 813982578
    1000 .... = Header Length: 32 bytes (8)
    Flags: 0x018 (PSH, ACK)
        000. .... .... = Reserved: Not set
        ...0 .... .... = Accurate ECN: Not set
        .... 0... .... = Congestion Window Reduced: Not set
        .... .0.. .... = ECN-Echo: Not set
        .... ..0. .... = Urgent: Not set
        .... ...1 .... = Acknowledgment: Set
        .... .... 1... = Push: Set
        .... .... .0.. = Reset: Not set
        .... .... ..0. = Syn: Not set
        .... .... ...0 = Fin: Not set
        [TCP Flags: ·······AP···]
    Window: 4096
    [Calculated window size: 1048576]
    [Window size scaling factor: 256]
    Checksum: 0xcc1e [unverified]
    [Checksum Status: Unverified]
    Urgent Pointer: 0
    Options: (12 bytes), No-Operation (NOP), No-Operation (NOP), Timestamps
        TCP Option - No-Operation (NOP)
            Kind: No-Operation (1)
        TCP Option - No-Operation (NOP)
            Kind: No-Operation (1)
        TCP Option - Timestamps: TSval 281264012, TSecr 2272454540
            Kind: Time Stamp Option (8)
            Length: 10
            Timestamp value: 281264012
            Timestamp echo reply: 2272454540
    [Timestamps]
        [Time since first frame in this TCP stream: 0.020371063 seconds]
        [Time since previous frame in this TCP stream: 0.012457876 seconds]
    [SEQ/ACK analysis]
        [This is an ACK to the segment in frame: 4]
        [The RTT to ACK the segment was: 0.012457876 seconds]
        [iRTT: 0.007783645 seconds]
        [Bytes in flight: 297]
        [Bytes sent since last PSH flag: 297]
    TCP payload (297 bytes)
Hypertext Transfer Protocol
    HTTP/1.1 302 Found\r\n
        [Expert Info (Chat/Sequence): HTTP/1.1 302 Found\r\n]
            [HTTP/1.1 302 Found\r\n]
            [Severity level: Chat]
            [Group: Sequence]
        Response Version: HTTP/1.1
        Status Code: 302
        [Status Code Description: Found]
        Response Phrase: Found
    Date: Tue, 12 Mar 2024 22:00:35 GMT\r\n
    Server: Apache/2.4.58 (Win64) OpenSSL/3.1.3 PHP/8.2.12\r\n
    X-Powered-By: PHP/8.2.12\r\n
    Location: http://172.24.1.12/dashboard/\r\n
    Content-Length: 0\r\n
        [Content length: 0]
    Keep-Alive: timeout=5, max=100\r\n
    Connection: Keep-Alive\r\n
    Content-Type: text/html; charset=UTF-8\r\n
    \r\n
    [HTTP response 1/5]
    [Time since request: 0.012457876 seconds]
    [Request in frame: 4]
    [Next request in frame: 7]
    [Next response in frame: 10]
    [Request URI: http://172.24.1.12/]

No.     Time               Source                Destination           Protocol Length Info
      7 22:00:34,843879450 172.24.1.11           172.24.1.12           HTTP     429    GET /dashboard/ HTTP/1.1 

Frame 7: 429 bytes on wire (3432 bits), 429 bytes captured (3432 bits) on interface wlp3s0, id 0
    Section number: 1
    Interface id: 0 (wlp3s0)
        Interface name: wlp3s0
    Encapsulation type: Ethernet (1)
    Arrival Time: Mar 12, 2024 22:00:34.843879450 WET
    UTC Arrival Time: Mar 12, 2024 22:00:34.843879450 UTC
    Epoch Arrival Time: 1710280834.843879450
    [Time shift for this packet: 0.000000000 seconds]
    [Time delta from previous captured frame: 0.010707264 seconds]
    [Time delta from previous displayed frame: 0.010781622 seconds]
    [Time since reference or first frame: 0.031152685 seconds]
    Frame Number: 7
    Frame Length: 429 bytes (3432 bits)
    Capture Length: 429 bytes (3432 bits)
    [Frame is marked: False]
    [Frame is ignored: False]
    [Protocols in frame: eth:ethertype:ip:tcp:http]
    [Coloring Rule Name: HTTP]
    [Coloring Rule String: http || tcp.port == 80 || http2]
Ethernet II, Src: Intel_d5:7a:9b (6c:29:95:d5:7a:9b), Dst: Intel_d0:e8:cd (a4:34:d9:d0:e8:cd)
    Destination: Intel_d0:e8:cd (a4:34:d9:d0:e8:cd)
        Address: Intel_d0:e8:cd (a4:34:d9:d0:e8:cd)
        .... ..0. .... .... .... .... = LG bit: Globally unique address (factory default)
        .... ...0 .... .... .... .... = IG bit: Individual address (unicast)
    Source: Intel_d5:7a:9b (6c:29:95:d5:7a:9b)
        Address: Intel_d5:7a:9b (6c:29:95:d5:7a:9b)
        .... ..0. .... .... .... .... = LG bit: Globally unique address (factory default)
        .... ...0 .... .... .... .... = IG bit: Individual address (unicast)
    Type: IPv4 (0x0800)
Internet Protocol Version 4, Src: 172.24.1.11, Dst: 172.24.1.12
    0100 .... = Version: 4
    .... 0101 = Header Length: 20 bytes (5)
    Differentiated Services Field: 0x00 (DSCP: CS0, ECN: Not-ECT)
        0000 00.. = Differentiated Services Codepoint: Default (0)
        .... ..00 = Explicit Congestion Notification: Not ECN-Capable Transport (0)
    Total Length: 415
    Identification: 0x9c93 (40083)
    010. .... = Flags: 0x2, Don't fragment
        0... .... = Reserved bit: Not set
        .1.. .... = Don't fragment: Set
        ..0. .... = More fragments: Not set
    ...0 0000 0000 0000 = Fragment Offset: 0
    Time to Live: 64
    Protocol: TCP (6)
    Header Checksum: 0x427e [validation disabled]
    [Header checksum status: Unverified]
    Source Address: 172.24.1.11
    Destination Address: 172.24.1.12
Transmission Control Protocol, Src Port: 39124, Dst Port: 80, Seq: 354, Ack: 298, Len: 363
    Source Port: 39124
    Destination Port: 80
    [Stream index: 0]
    [Conversation completeness: Incomplete, DATA (15)]
        ..0. .... = RST: Absent
        ...0 .... = FIN: Absent
        .... 1... = Data: Present
        .... .1.. = ACK: Present
        .... ..1. = SYN-ACK: Present
        .... ...1 = SYN: Present
        [Completeness Flags: ··DASS]
    [TCP Segment Len: 363]
    Sequence Number: 354    (relative sequence number)
    Sequence Number (raw): 813982578
    [Next Sequence Number: 717    (relative sequence number)]
    Acknowledgment Number: 298    (relative ack number)
    Acknowledgment number (raw): 914782954
    1000 .... = Header Length: 32 bytes (8)
    Flags: 0x018 (PSH, ACK)
        000. .... .... = Reserved: Not set
        ...0 .... .... = Accurate ECN: Not set
        .... 0... .... = Congestion Window Reduced: Not set
        .... .0.. .... = ECN-Echo: Not set
        .... ..0. .... = Urgent: Not set
        .... ...1 .... = Acknowledgment: Set
        .... .... 1... = Push: Set
        .... .... .0.. = Reset: Not set
        .... .... ..0. = Syn: Not set
        .... .... ...0 = Fin: Not set
        [TCP Flags: ·······AP···]
    Window: 249
    [Calculated window size: 31872]
    [Window size scaling factor: 128]
    Checksum: 0x7376 [unverified]
    [Checksum Status: Unverified]
    Urgent Pointer: 0
    Options: (12 bytes), No-Operation (NOP), No-Operation (NOP), Timestamps
        TCP Option - No-Operation (NOP)
            Kind: No-Operation (1)
        TCP Option - No-Operation (NOP)
            Kind: No-Operation (1)
        TCP Option - Timestamps: TSval 2272454563, TSecr 281264012
            Kind: Time Stamp Option (8)
            Length: 10
            Timestamp value: 2272454563
            Timestamp echo reply: 281264012
    [Timestamps]
        [Time since first frame in this TCP stream: 0.031152685 seconds]
        [Time since previous frame in this TCP stream: 0.010707264 seconds]
    [SEQ/ACK analysis]
        [iRTT: 0.007783645 seconds]
        [Bytes in flight: 363]
        [Bytes sent since last PSH flag: 363]
    TCP payload (363 bytes)
Hypertext Transfer Protocol
    GET /dashboard/ HTTP/1.1\r\n
        [Expert Info (Chat/Sequence): GET /dashboard/ HTTP/1.1\r\n]
            [GET /dashboard/ HTTP/1.1\r\n]
            [Severity level: Chat]
            [Group: Sequence]
        Request Method: GET
        Request URI: /dashboard/
        Request Version: HTTP/1.1
    Host: 172.24.1.12\r\n
    User-Agent: Mozilla/5.0 (Windows NT 10.0; rv:123.0) Gecko/20100101 Firefox/123.0\r\n
    Accept: text/html,application/xhtml+xml,application/xml;q=0.9,image/avif,image/webp,*/*;q=0.8\r\n
    Accept-Language: en-US,en;q=0.5\r\n
    Accept-Encoding: gzip, deflate\r\n
    DNT: 1\r\n
    Sec-GPC: 1\r\n
    Connection: keep-alive\r\n
    Upgrade-Insecure-Requests: 1\r\n
    \r\n
    [Full request URI: http://172.24.1.12/dashboard/]
    [HTTP request 2/5]
    [Prev request in frame: 4]
    [Response in frame: 10]
    [Next request in frame: 12]

No.     Time               Source                Destination           Protocol Length Info
     10 22:00:34,856706093 172.24.1.12           172.24.1.11           HTTP     1507   HTTP/1.1 200 OK  (text/html)

Frame 10: 1507 bytes on wire (12056 bits), 1507 bytes captured (12056 bits) on interface wlp3s0, id 0
    Section number: 1
    Interface id: 0 (wlp3s0)
        Interface name: wlp3s0
    Encapsulation type: Ethernet (1)
    Arrival Time: Mar 12, 2024 22:00:34.856706093 WET
    UTC Arrival Time: Mar 12, 2024 22:00:34.856706093 UTC
    Epoch Arrival Time: 1710280834.856706093
    [Time shift for this packet: 0.000000000 seconds]
    [Time delta from previous captured frame: 0.000261883 seconds]
    [Time delta from previous displayed frame: 0.012826643 seconds]
    [Time since reference or first frame: 0.043979328 seconds]
    Frame Number: 10
    Frame Length: 1507 bytes (12056 bits)
    Capture Length: 1507 bytes (12056 bits)
    [Frame is marked: False]
    [Frame is ignored: False]
    [Protocols in frame: eth:ethertype:ip:tcp:http:data-text-lines]
    [Coloring Rule Name: HTTP]
    [Coloring Rule String: http || tcp.port == 80 || http2]
Ethernet II, Src: Intel_d0:e8:cd (a4:34:d9:d0:e8:cd), Dst: Intel_d5:7a:9b (6c:29:95:d5:7a:9b)
    Destination: Intel_d5:7a:9b (6c:29:95:d5:7a:9b)
        Address: Intel_d5:7a:9b (6c:29:95:d5:7a:9b)
        .... ..0. .... .... .... .... = LG bit: Globally unique address (factory default)
        .... ...0 .... .... .... .... = IG bit: Individual address (unicast)
    Source: Intel_d0:e8:cd (a4:34:d9:d0:e8:cd)
        Address: Intel_d0:e8:cd (a4:34:d9:d0:e8:cd)
        .... ..0. .... .... .... .... = LG bit: Globally unique address (factory default)
        .... ...0 .... .... .... .... = IG bit: Individual address (unicast)
    Type: IPv4 (0x0800)
Internet Protocol Version 4, Src: 172.24.1.12, Dst: 172.24.1.11
    0100 .... = Version: 4
    .... 0101 = Header Length: 20 bytes (5)
    Differentiated Services Field: 0x00 (DSCP: CS0, ECN: Not-ECT)
        0000 00.. = Differentiated Services Codepoint: Default (0)
        .... ..00 = Explicit Congestion Notification: Not ECN-Capable Transport (0)
    Total Length: 1493
    Identification: 0x16ba (5818)
    010. .... = Flags: 0x2, Don't fragment
        0... .... = Reserved bit: Not set
        .1.. .... = Don't fragment: Set
        ..0. .... = More fragments: Not set
    ...0 0000 0000 0000 = Fragment Offset: 0
    Time to Live: 128
    Protocol: TCP (6)
    Header Checksum: 0x8421 [validation disabled]
    [Header checksum status: Unverified]
    Source Address: 172.24.1.12
    Destination Address: 172.24.1.11
Transmission Control Protocol, Src Port: 80, Dst Port: 39124, Seq: 4354, Ack: 717, Len: 1441
    Source Port: 80
    Destination Port: 39124
    [Stream index: 0]
    [Conversation completeness: Incomplete, DATA (15)]
        ..0. .... = RST: Absent
        ...0 .... = FIN: Absent
        .... 1... = Data: Present
        .... .1.. = ACK: Present
        .... ..1. = SYN-ACK: Present
        .... ...1 = SYN: Present
        [Completeness Flags: ··DASS]
    [TCP Segment Len: 1441]
    Sequence Number: 4354    (relative sequence number)
    Sequence Number (raw): 914787010
    [Next Sequence Number: 5795    (relative sequence number)]
    Acknowledgment Number: 717    (relative ack number)
    Acknowledgment number (raw): 813982941
    1000 .... = Header Length: 32 bytes (8)
    Flags: 0x018 (PSH, ACK)
        000. .... .... = Reserved: Not set
        ...0 .... .... = Accurate ECN: Not set
        .... 0... .... = Congestion Window Reduced: Not set
        .... .0.. .... = ECN-Echo: Not set
        .... ..0. .... = Urgent: Not set
        .... ...1 .... = Acknowledgment: Set
        .... .... 1... = Push: Set
        .... .... .0.. = Reset: Not set
        .... .... ..0. = Syn: Not set
        .... .... ...0 = Fin: Not set
        [TCP Flags: ·······AP···]
    Window: 4095
    [Calculated window size: 1048320]
    [Window size scaling factor: 256]
    Checksum: 0x600f [unverified]
    [Checksum Status: Unverified]
    Urgent Pointer: 0
    Options: (12 bytes), No-Operation (NOP), No-Operation (NOP), Timestamps
        TCP Option - No-Operation (NOP)
            Kind: No-Operation (1)
        TCP Option - No-Operation (NOP)
            Kind: No-Operation (1)
        TCP Option - Timestamps: TSval 281264042, TSecr 2272454563
            Kind: Time Stamp Option (8)
            Length: 10
            Timestamp value: 281264042
            Timestamp echo reply: 2272454563
    [Timestamps]
        [Time since first frame in this TCP stream: 0.043979328 seconds]
        [Time since previous frame in this TCP stream: 0.000261883 seconds]
    [SEQ/ACK analysis]
        [iRTT: 0.007783645 seconds]
        [Bytes in flight: 1441]
        [Bytes sent since last PSH flag: 5497]
    TCP payload (1441 bytes)
    TCP segment data (1441 bytes)
[2 Reassembled TCP Segments (5497 bytes): #8(4056), #10(1441)]
    [Frame: 8, payload: 0-4055 (4056 bytes)]
    [Frame: 10, payload: 4056-5496 (1441 bytes)]
    [Segment count: 2]
    [Reassembled TCP length: 5497]
    [Reassembled TCP Data [truncated]: 485454502f312e3120323030204f4b0d0a446174653a205475652c203132204d617220323032342032323a30303a333520474d540d0a5365727665723a204170616368652f322e342e3538202857696e363429204f70656e53534c2f332e312e33205048502f3]
Hypertext Transfer Protocol
    HTTP/1.1 200 OK\r\n
        [Expert Info (Chat/Sequence): HTTP/1.1 200 OK\r\n]
            [HTTP/1.1 200 OK\r\n]
            [Severity level: Chat]
            [Group: Sequence]
        Response Version: HTTP/1.1
        Status Code: 200
        [Status Code Description: OK]
        Response Phrase: OK
    Date: Tue, 12 Mar 2024 22:00:35 GMT\r\n
    Server: Apache/2.4.58 (Win64) OpenSSL/3.1.3 PHP/8.2.12\r\n
    Last-Modified: Sun, 19 Nov 2023 11:18:30 GMT\r\n
    ETag: "1443-60a7f87754d80"\r\n
    Accept-Ranges: bytes\r\n
    Content-Length: 5187\r\n
        [Content length: 5187]
    Keep-Alive: timeout=5, max=99\r\n
    Connection: Keep-Alive\r\n
    Content-Type: text/html\r\n
    \r\n
    [HTTP response 2/5]
    [Time since request: 0.012826643 seconds]
    [Prev request in frame: 4]
    [Prev response in frame: 5]
    [Request in frame: 7]
    [Next request in frame: 12]
    [Next response in frame: 24]
    [Request URI: http://172.24.1.12/dashboard/]
    File Data: 5187 bytes
Line-based text data: text/html (130 lines)
    <!doctype html>\n
    <html lang="en">\n
      <head>\n
        <meta charset="utf-8">\n
        <!-- Always force latest IE rendering engine or request Chrome Frame -->\n
        <meta content="IE=edge,chrome=1" http-equiv="X-UA-Compatible">\n
        <meta name="viewport" content="width=device-width, initial-scale=1.0" />\n
    \n
        <!-- Use title if it's in the page YAML frontmatter -->\n
        <title>Welcome to XAMPP</title>\n
    \n
        <meta name="description" content="XAMPP is an easy to install Apache distribution containing MariaDB, PHP and Perl." />\n
        <meta name="keywords" content="xampp, apache, php, perl, mariadb, open source distribution" />\n
    \n
        <link href="/dashboard/stylesheets/normalize.css" rel="stylesheet" type="text/css" /><link href="/dashboard/stylesheets/all.css" rel="stylesheet" type="text/css" />\n
        <link href="//cdnjs.cloudflare.com/ajax/libs/font-awesome/3.1.0/css/font-awesome.min.css" rel="stylesheet" type="text/css" />\n
    \n
        <script src="/dashboard/javascripts/modernizr.js" type="text/javascript"></script>\n
    \n
    \n
        <link href="/dashboard/images/favicon.png" rel="icon" type="image/png" />\n
    \n
    \n
      </head>\n
    \n
      <body class="index">\n
        <div id="fb-root"></div>\n
        <script>(function(d, s, id) {\n
          var js, fjs = d.getElementsByTagName(s)[0];\n
          if (d.getElementById(id)) return;\n
          js = d.createElement(s); js.id = id;\n
          js.src = "//connect.facebook.net/en_US/all.js#xfbml=1&appId=277385395761685";\n
          fjs.parentNode.insertBefore(js, fjs);\n
        }(document, 'script', 'facebook-jssdk'));</script>\n
        <header class="header contain-to-grid">\n
          <nav class="top-bar" data-topbar>\n
            <ul class="title-area">\n
              <li class="name">\n
                <h1><a href="/dashboard/index.html">Apache Friends</a></h1>\n
              </li>\n
              <li class="toggle-topbar menu-icon">\n
                <a href="#">\n
                  <span>Menu</span>\n
                </a>\n
              </li>\n
            </ul>\n
    \n
            <section class="top-bar-section">\n
              <!-- Left Nav Section -->\n
              <ul class="left">\n
                  <li class="item "><a href="/dashboard/faq.html">FAQs</a></li>\n
                  <li class="item "><a href="/dashboard/howto.html">HOW-TO Guides</a></li>\n
                  <li class="item "><a target="_blank" href="/dashboard/phpinfo.php">PHPInfo</a></li>\n
                  <li class="item "><a href="/phpmyadmin/">phpMyAdmin</a></li>\n
              </ul>\n
            </section>\n
          </nav>\n
        </header>\n
    \n
        <div class="wrapper">\n
          <div class="hero">\n
      <div class="row">\n
        <div class="large-12 columns">\n
          <h1><img src="/dashboard/images/xampp-logo.svg" />XAMPP <span>Apache + MariaDB + PHP + Perl</span></h1>\n
        </div>\n
      </div>\n
    </div>\n
    <div class="row">\n
      <div class="large-12 columns">\n
        <h2>Welcome to XAMPP for Windows 8.2.12</h2>\n
      </div>\n
    </div>\n
    <div class="row">\n
      <div class="large-12 columns">\n
        <p>\n
          You have successfully installed XAMPP on this system! Now you can start using Apache, MariaDB, PHP and other components.\n
          You can find more info in the <a href="/dashboard/faq.html">FAQs</a> section or check the <a href="/dashboard/howto.html">HOW-TO Guides</a> for getting started with PHP applications.\n
        </p>\n
        <p>\n
          XAMPP is meant only for development purposes. It has certain configuration settings that make it easy to develop locally but that are insecure if you want to have your installation accessible to others.\n
        </p>\n
        <p>\n
          Start the XAMPP Control Panel to check the server status.\n
        </p>\n
      </div>\n
    </div>\n
    <div class="row">\n
      <div class="large-12 columns">\n
        <h3>Community</h3>\n
      </div>\n
    </div>\n
    <div class="row">\n
      <div class="large-12 columns">\n
        <p>\n
     [truncated]      XAMPP has been around for more than 10 years &ndash; there is a huge community behind it. You can get involved by joining our <a href="https://community.apachefriends.org">Forums</a>, liking us on <a href="https://www.fac
        </p>\n
      </div>\n
    </div>\n
    \n
    \n
        </div>\n
    \n
        <footer class="footer row">\n
          <div class="columns">\n
            <div class="footer_lists-container row collapse">\n
              <div class="footer_social columns large-2">\n
                <ul class="social">\n
      <li class="twitter"><a href="https://twitter.com/apachefriends">Follow us on Twitter</a></li>\n
      <li class="facebook"><a href="https://www.facebook.com/we.are.xampp">Like us on Facebook</a></li>\n
    </ul>\n
    \n
                <p class="footer_copyright">Copyright (c) 2022, Apache Friends</p>\n
              </div>\n
              <ul class="footer_links columns large-9">\n
                <li><a href="https://www.apachefriends.org/blog.html">Blog</a></li>\n
                <li><a href="/privacy_policy.html">Privacy Policy</a></li>\n
                <li>\n
    <a target="_blank" href="http://www.fastly.com/">                CDN provided by\n
                    <img width="48" data-2x="/dashboard/images/fastly-logo@2x.png" src="/dashboard/images/fastly-logo.png" />\n
    </a>            </li>\n
              </ul>\n
            </div>\n
          </div>\n
        </footer>\n
    \n
        <!-- JS Libraries -->\n
        <script src="//code.jquery.com/jquery-1.10.2.min.js"></script>\n
        <script src="/dashboard/javascripts/all.js" type="text/javascript"></script>\n
      </body>\n
    </html>\n

No.     Time               Source                Destination           Protocol Length Info
     12 22:00:34,935265914 172.24.1.11           172.24.1.12           HTTP     397    GET /dashboard/stylesheets/normalize.css HTTP/1.1 

Frame 12: 397 bytes on wire (3176 bits), 397 bytes captured (3176 bits) on interface wlp3s0, id 0
    Section number: 1
    Interface id: 0 (wlp3s0)
        Interface name: wlp3s0
    Encapsulation type: Ethernet (1)
    Arrival Time: Mar 12, 2024 22:00:34.935265914 WET
    UTC Arrival Time: Mar 12, 2024 22:00:34.935265914 UTC
    Epoch Arrival Time: 1710280834.935265914
    [Time shift for this packet: 0.000000000 seconds]
    [Time delta from previous captured frame: 0.078510290 seconds]
    [Time delta from previous displayed frame: 0.078559821 seconds]
    [Time since reference or first frame: 0.122539149 seconds]
    Frame Number: 12
    Frame Length: 397 bytes (3176 bits)
    Capture Length: 397 bytes (3176 bits)
    [Frame is marked: False]
    [Frame is ignored: False]
    [Protocols in frame: eth:ethertype:ip:tcp:http]
    [Coloring Rule Name: HTTP]
    [Coloring Rule String: http || tcp.port == 80 || http2]
Ethernet II, Src: Intel_d5:7a:9b (6c:29:95:d5:7a:9b), Dst: Intel_d0:e8:cd (a4:34:d9:d0:e8:cd)
    Destination: Intel_d0:e8:cd (a4:34:d9:d0:e8:cd)
        Address: Intel_d0:e8:cd (a4:34:d9:d0:e8:cd)
        .... ..0. .... .... .... .... = LG bit: Globally unique address (factory default)
        .... ...0 .... .... .... .... = IG bit: Individual address (unicast)
    Source: Intel_d5:7a:9b (6c:29:95:d5:7a:9b)
        Address: Intel_d5:7a:9b (6c:29:95:d5:7a:9b)
        .... ..0. .... .... .... .... = LG bit: Globally unique address (factory default)
        .... ...0 .... .... .... .... = IG bit: Individual address (unicast)
    Type: IPv4 (0x0800)
Internet Protocol Version 4, Src: 172.24.1.11, Dst: 172.24.1.12
    0100 .... = Version: 4
    .... 0101 = Header Length: 20 bytes (5)
    Differentiated Services Field: 0x00 (DSCP: CS0, ECN: Not-ECT)
        0000 00.. = Differentiated Services Codepoint: Default (0)
        .... ..00 = Explicit Congestion Notification: Not ECN-Capable Transport (0)
    Total Length: 383
    Identification: 0x9c96 (40086)
    010. .... = Flags: 0x2, Don't fragment
        0... .... = Reserved bit: Not set
        .1.. .... = Don't fragment: Set
        ..0. .... = More fragments: Not set
    ...0 0000 0000 0000 = Fragment Offset: 0
    Time to Live: 64
    Protocol: TCP (6)
    Header Checksum: 0x429b [validation disabled]
    [Header checksum status: Unverified]
    Source Address: 172.24.1.11
    Destination Address: 172.24.1.12
Transmission Control Protocol, Src Port: 39124, Dst Port: 80, Seq: 717, Ack: 5795, Len: 331
    Source Port: 39124
    Destination Port: 80
    [Stream index: 0]
    [Conversation completeness: Incomplete, DATA (15)]
        ..0. .... = RST: Absent
        ...0 .... = FIN: Absent
        .... 1... = Data: Present
        .... .1.. = ACK: Present
        .... ..1. = SYN-ACK: Present
        .... ...1 = SYN: Present
        [Completeness Flags: ··DASS]
    [TCP Segment Len: 331]
    Sequence Number: 717    (relative sequence number)
    Sequence Number (raw): 813982941
    [Next Sequence Number: 1048    (relative sequence number)]
    Acknowledgment Number: 5795    (relative ack number)
    Acknowledgment number (raw): 914788451
    1000 .... = Header Length: 32 bytes (8)
    Flags: 0x018 (PSH, ACK)
        000. .... .... = Reserved: Not set
        ...0 .... .... = Accurate ECN: Not set
        .... 0... .... = Congestion Window Reduced: Not set
        .... .0.. .... = ECN-Echo: Not set
        .... ..0. .... = Urgent: Not set
        .... ...1 .... = Acknowledgment: Set
        .... .... 1... = Push: Set
        .... .... .0.. = Reset: Not set
        .... .... ..0. = Syn: Not set
        .... .... ...0 = Fin: Not set
        [TCP Flags: ·······AP···]
    Window: 249
    [Calculated window size: 31872]
    [Window size scaling factor: 128]
    Checksum: 0xe40b [unverified]
    [Checksum Status: Unverified]
    Urgent Pointer: 0
    Options: (12 bytes), No-Operation (NOP), No-Operation (NOP), Timestamps
        TCP Option - No-Operation (NOP)
            Kind: No-Operation (1)
        TCP Option - No-Operation (NOP)
            Kind: No-Operation (1)
        TCP Option - Timestamps: TSval 2272454654, TSecr 281264042
            Kind: Time Stamp Option (8)
            Length: 10
            Timestamp value: 2272454654
            Timestamp echo reply: 281264042
    [Timestamps]
        [Time since first frame in this TCP stream: 0.122539149 seconds]
        [Time since previous frame in this TCP stream: 0.078510290 seconds]
    [SEQ/ACK analysis]
        [iRTT: 0.007783645 seconds]
        [Bytes in flight: 331]
        [Bytes sent since last PSH flag: 331]
    TCP payload (331 bytes)
Hypertext Transfer Protocol
    GET /dashboard/stylesheets/normalize.css HTTP/1.1\r\n
        [Expert Info (Chat/Sequence): GET /dashboard/stylesheets/normalize.css HTTP/1.1\r\n]
            [GET /dashboard/stylesheets/normalize.css HTTP/1.1\r\n]
            [Severity level: Chat]
            [Group: Sequence]
        Request Method: GET
        Request URI: /dashboard/stylesheets/normalize.css
        Request Version: HTTP/1.1
    Host: 172.24.1.12\r\n
    User-Agent: Mozilla/5.0 (Windows NT 10.0; rv:123.0) Gecko/20100101 Firefox/123.0\r\n
    Accept: text/css,*/*;q=0.1\r\n
    Accept-Language: en-US,en;q=0.5\r\n
    Accept-Encoding: gzip, deflate\r\n
    DNT: 1\r\n
    Sec-GPC: 1\r\n
    Connection: keep-alive\r\n
    Referer: http://172.24.1.12/dashboard/\r\n
    \r\n
    [Full request URI: http://172.24.1.12/dashboard/stylesheets/normalize.css]
    [HTTP request 3/5]
    [Prev request in frame: 7]
    [Response in frame: 24]
    [Next request in frame: 26]

No.     Time               Source                Destination           Protocol Length Info
     18 22:00:34,942578273 172.24.1.11           172.24.1.12           HTTP     391    GET /dashboard/stylesheets/all.css HTTP/1.1 

Frame 18: 391 bytes on wire (3128 bits), 391 bytes captured (3128 bits) on interface wlp3s0, id 0
    Section number: 1
    Interface id: 0 (wlp3s0)
        Interface name: wlp3s0
    Encapsulation type: Ethernet (1)
    Arrival Time: Mar 12, 2024 22:00:34.942578273 WET
    UTC Arrival Time: Mar 12, 2024 22:00:34.942578273 UTC
    Epoch Arrival Time: 1710280834.942578273
    [Time shift for this packet: 0.000000000 seconds]
    [Time delta from previous captured frame: 0.000152140 seconds]
    [Time delta from previous displayed frame: 0.007312359 seconds]
    [Time since reference or first frame: 0.129851508 seconds]
    Frame Number: 18
    Frame Length: 391 bytes (3128 bits)
    Capture Length: 391 bytes (3128 bits)
    [Frame is marked: False]
    [Frame is ignored: False]
    [Protocols in frame: eth:ethertype:ip:tcp:http]
    [Coloring Rule Name: HTTP]
    [Coloring Rule String: http || tcp.port == 80 || http2]
Ethernet II, Src: Intel_d5:7a:9b (6c:29:95:d5:7a:9b), Dst: Intel_d0:e8:cd (a4:34:d9:d0:e8:cd)
    Destination: Intel_d0:e8:cd (a4:34:d9:d0:e8:cd)
        Address: Intel_d0:e8:cd (a4:34:d9:d0:e8:cd)
        .... ..0. .... .... .... .... = LG bit: Globally unique address (factory default)
        .... ...0 .... .... .... .... = IG bit: Individual address (unicast)
    Source: Intel_d5:7a:9b (6c:29:95:d5:7a:9b)
        Address: Intel_d5:7a:9b (6c:29:95:d5:7a:9b)
        .... ..0. .... .... .... .... = LG bit: Globally unique address (factory default)
        .... ...0 .... .... .... .... = IG bit: Individual address (unicast)
    Type: IPv4 (0x0800)
Internet Protocol Version 4, Src: 172.24.1.11, Dst: 172.24.1.12
    0100 .... = Version: 4
    .... 0101 = Header Length: 20 bytes (5)
    Differentiated Services Field: 0x00 (DSCP: CS0, ECN: Not-ECT)
        0000 00.. = Differentiated Services Codepoint: Default (0)
        .... ..00 = Explicit Congestion Notification: Not ECN-Capable Transport (0)
    Total Length: 377
    Identification: 0x7c07 (31751)
    010. .... = Flags: 0x2, Don't fragment
        0... .... = Reserved bit: Not set
        .1.. .... = Don't fragment: Set
        ..0. .... = More fragments: Not set
    ...0 0000 0000 0000 = Fragment Offset: 0
    Time to Live: 64
    Protocol: TCP (6)
    Header Checksum: 0x6330 [validation disabled]
    [Header checksum status: Unverified]
    Source Address: 172.24.1.11
    Destination Address: 172.24.1.12
Transmission Control Protocol, Src Port: 39136, Dst Port: 80, Seq: 1, Ack: 1, Len: 325
    Source Port: 39136
    Destination Port: 80
    [Stream index: 1]
    [Conversation completeness: Incomplete, DATA (15)]
        ..0. .... = RST: Absent
        ...0 .... = FIN: Absent
        .... 1... = Data: Present
        .... .1.. = ACK: Present
        .... ..1. = SYN-ACK: Present
        .... ...1 = SYN: Present
        [Completeness Flags: ··DASS]
    [TCP Segment Len: 325]
    Sequence Number: 1    (relative sequence number)
    Sequence Number (raw): 2958064993
    [Next Sequence Number: 326    (relative sequence number)]
    Acknowledgment Number: 1    (relative ack number)
    Acknowledgment number (raw): 3482795207
    1000 .... = Header Length: 32 bytes (8)
    Flags: 0x018 (PSH, ACK)
        000. .... .... = Reserved: Not set
        ...0 .... .... = Accurate ECN: Not set
        .... 0... .... = Congestion Window Reduced: Not set
        .... .0.. .... = ECN-Echo: Not set
        .... ..0. .... = Urgent: Not set
        .... ...1 .... = Acknowledgment: Set
        .... .... 1... = Push: Set
        .... .... .0.. = Reset: Not set
        .... .... ..0. = Syn: Not set
        .... .... ...0 = Fin: Not set
        [TCP Flags: ·······AP···]
    Window: 251
    [Calculated window size: 32128]
    [Window size scaling factor: 128]
    Checksum: 0x5d21 [unverified]
    [Checksum Status: Unverified]
    Urgent Pointer: 0
    Options: (12 bytes), No-Operation (NOP), No-Operation (NOP), Timestamps
        TCP Option - No-Operation (NOP)
            Kind: No-Operation (1)
        TCP Option - No-Operation (NOP)
            Kind: No-Operation (1)
        TCP Option - Timestamps: TSval 2272454662, TSecr 281264130
            Kind: Time Stamp Option (8)
            Length: 10
            Timestamp value: 2272454662
            Timestamp echo reply: 281264130
    [Timestamps]
